{
  "project": "CTB-01", "task": "CTB-004", "release": "DESIGN_ONLY",
  "source_commit": "f49e3b3be73b7d474302823cc9072148319c8f67",
  "approved_sources": ["SOFT_CURVE", "B_THROUGH_ADHESIVE", "A_COMPACT_CLOSED", "Y_FIRST"],
  "disk_diameter_mm": 190, "thickness_mm": 6,
  "layers_z_mm": {"P04L": [456,462], "P04U": [480,486]},
  "tongue_allowance_radial_each_side_mm": 0.2,
  "tongue_allowance_t_each_side_mm": 0.1, "tongue_slot_corner_radius_mm": 0.2,
  "web_slot_width_mm": 6.4, "web_thickness_mm": 6,
  "open_start_r_mm": {"P04L": 80.8, "P04U": 82.8},
  "rail_cut_r_mm": {"P04L": [81.3,88.7], "P04U": [81.8,88.2]},
  "open_witness_relief_rz_mm": [81,479.8,83,486.2],
  "rail_r_mm": [82,88], "outer_web_start_r_mm": 95.4,
  "bridge_rz_mm": [81,466,95.4,472],
  "web_range_r_mm": [81,169], "web_range_z_mm": [456,494],
  "center_study_diameters_mm": [0,24,36],
  "center_assumed_probe_diameter_mm": 20,
  "variants": {"A": {"name":"A_RIM_OPEN", "upper_center_diameter_mm":0},
               "B": {"name":"B_CLOSED_RAIL", "upper_center_diameter_mm":0},
               "C": {"name":"C_MIXED_ACCESS", "upper_center_diameter_mm":24}},
  "path_start_bottom_z_mm": 520, "web_radial_stroke_mm": 100,
  "sheet_hw_mm": [800,440], "sheet_margin_mm": 10, "raster_dpi":96,
  "circle_segments":360, "epsilon_mm3":0.000001,
  "measured_material_thickness_mm":null, "measured_kerf_mm":null,
  "relevant_interfaces": ["IF-03","IF-04","IF-05","IF-06","IF-08","IF-12","IF-13"]
}
